{
  "fixtureCode": "DOCX_TECH_SPEC_001",
  "displayName": "DOCX Technical Specification 001",
  "slice": {
    "documentPurpose": "TENDER_SPECIFICATION",
    "format": "DOCX",
    "contentMode": "DOCX_STRUCTURED",
    "layoutMode": "STANDARD",
    "language": "tr",
    "gate": "E2E-03-docx"
  },
  "asset": {
    "relativePath": "docx/docx_tech_spec_001.docx",
    "sha256": null,
    "mediaType": "application/vnd.openxmlformats-officedocument.wordprocessingml.document",
    "expectedPageCount": null,
    "required": true
  },
  "provenance": {
    "sourceType": "USER_PROVIDED",
    "sourceReference": null,
    "organizationOwner": null,
    "acquiredAt": null
  },
  "license": {
    "status": "PENDING",
    "type": null,
    "reference": null,
    "commercialEvaluationAllowed": false,
    "redistributionAllowed": false
  },
  "privacy": {
    "containsPersonalData": "UNKNOWN",
    "containsConfidentialData": "UNKNOWN",
    "redactionStatus": "NOT_REVIEWED"
  },
  "groundTruth": {
    "status": "PENDING",
    "annotationPath": null,
    "reviewedBy": null,
    "reviewedAt": null
  },
  "expectedBehavior": {
    "parserTerminal": true,
    "minimumPageCount": 1,
    "minimumClauseCount": 1,
    "minimumAutomaticRequirementCount": 1,
    "manualClauseSeed": 0,
    "manualRequirementSeed": 0,
    "reportIntegrity": "PASS"
  }
}
